{
  "slug": "what-is-agi-explained-2026",
  "title": "What Is AGI? A Plain-English Explainer for 2026",
  "date": "2026-04-30T03:00:00Z",
  "summary": "Artificial general intelligence (AGI) means a system that can learn any intellectual task a human can. This piece breaks down current research progress, where the term comes from, and why definitions still vary.",
  "content": "## What AGI actually means\n\nAGI describes a hypothetical system that can learn or perform any intellectual task that a human being can. The term has been used inconsistently for decades, which is part of why current debates feel so confusing. In the video, Matt Wolfe walks through several mainstream definitions, including the OpenAI charter version and DeepMind's task-coverage framing. Each definition emphasizes a different dimension of capability, and that divergence is not accidental — it reflects genuine scientific uncertainty about what general intelligence even is.\n\nThe phrase AGI first gained traction in early research literature as a way to distinguish the long-term goal from the narrow tools built for specific domains. A chess engine is not AGI because it cannot transfer its skills to checkers, let alone to writing code or diagnosing medical images. A large language model scores higher on the transfer dimension, but still falls short when you probe for causal reasoning in genuinely novel domains. This gap is what researchers spend most of their time measuring and arguing about.\n\n## Why definitions still vary\n\nResearchers disagree on whether AGI requires consciousness, embodiment, or merely matching human performance on a broad set of benchmarks. The video makes the case that benchmark-based definitions are easier to falsify but tend to drift as benchmarks saturate. Each new generation of model raises the floor of what observers expect from a system before they call it general.\n\nThis benchmark treadmill is a well-documented phenomenon. When GPT-3 appeared, many said passing a bar exam would prove general capability. When GPT-4 passed it, the same observers argued the bar exam was too narrow to count. Some philosophers argue this is motivated reasoning: humans keep moving the goalposts because accepting AGI implies uncomfortable conclusions about labor, autonomy, and moral status. Others argue it is rational calibration: the tests were indeed too easy, and we should keep raising the bar as understanding improves.\n\nThere is also a meaningful split between researchers who want a single unified benchmark and those who prefer task portfolios. A portfolio approach tests hundreds of skills simultaneously — cooking instructions, legal reasoning, robot arm control — and looks for consistent performance across all of them. Proponents say this is harder to game than any single test. Critics say it introduces its own subjectivity: whose list of tasks counts as comprehensive?\n\n## The progress signals to watch\n\nMatt Wolfe highlights three practical signals: transfer learning to genuinely novel tasks without retraining, sustained behavior over long horizons, and the ability to pick up new skills from a handful of examples in domains the model has never seen. None of those is sufficient on its own, but the argument is that progress on all three together is the clearest evidence we have moved closer to general capability.\n\nTransfer is probably the most tractable signal to measure today. Current frontier models show surprisingly broad transfer across language tasks, yet still fail when the reasoning chain requires physical intuition or sequential planning beyond a certain depth. The depth limit moves with each new model generation, which is why researchers track not just whether a model can solve a problem but how it fails at the edge cases.\n\nLong-horizon behavior is harder to evaluate because it requires infrastructure: you need to run the model for hours or days inside a realistic environment, log every action and error, and verify at the end that the goal was actually achieved rather than just claimed. Several research teams have started publishing evals of this type, and the results are mixed. Models that score well on reasoning benchmarks often behave erratically when given a multi-day task, because error accumulation over long action sequences overwhelms self-correction ability.\n\nFew-shot skill pickup is perhaps the most compelling signal when it works. A system that can watch three demonstrations of a new task and then replicate it in a new context is exhibiting something that looks genuinely general. We have seen this in narrow laboratory settings, but it has not yet transferred reliably to open-ended real-world scenarios.\n\n## What this means for builders\n\nFor product engineers, the takeaway is to design systems that gracefully degrade when the model is wrong, log what tasks it fails on, and treat improving capability as a moving baseline rather than a one-time integration. Relying on benchmark scores from last quarter is a recipe for surprise: a model you tuned around may be superseded in months, and the replacement may fail differently on the same edge cases you thought you had covered.\n\nPractical advice from the video includes investing in evaluation pipelines before investing in features. If you cannot measure whether your system is getting better or worse on the tasks that matter to your users, you have no feedback loop. This is not a new idea in software development, but it takes on special weight with these systems because the failure modes are less deterministic and harder to reproduce.\n\nThe video also emphasizes that the AGI label matters less to builders than the specific capability curve of the model they are deploying. Two models with very different benchmark scores can behave identically on a narrow production task, while two models with similar scores can diverge dramatically on edge cases. Understanding your actual workload is more useful than tracking the AGI debate from the sidelines.\n\n## Source\n\nThis article summarizes [\"What Is AGI? A 2026 Update\"](https://www.youtube.com/watch?v=dQw4w9WgXcQ) by Matt Wolfe (@mreflow). Watch the original for the full discussion and citations.",
  "author": "HelpAGI Editorial Team",
  "category": "AGI",
  "tags": ["AGI", "AI research", "definitions", "benchmarks", "transfer learning"],
  "readingMinutes": 6,
  "focusKeyword": "AGI definition",
  "keywords": ["AGI", "artificial general intelligence", "definition", "benchmarks"],
  "contentType": "explainer",
  "mainTopic": "Artificial General Intelligence",
  "complexity": "intermediate",
  "audience": "AI-curious engineers and product builders",
  "optimizedForScoring": true,
  "scoringVersion": "2.0",
  "sourceVideo": {
    "id": "dQw4w9WgXcQ",
    "title": "What Is AGI? A 2026 Update",
    "channel": "Matt Wolfe",
    "channelHandle": "@mreflow",
    "url": "https://www.youtube.com/watch?v=dQw4w9WgXcQ",
    "publishedAt": "2026-04-29T18:30:00Z",
    "durationSeconds": 720
  },
  "imageUrl": "https://dnsmalla.github.io/helpagi-content/images/what-is-agi-explained-2026.jpg"
}
